EDN1	1906	AlteredExpression	BEFREE	Furthermore, erythromycin and clarithromycin inhibited <span class= gene  id= 9701415-7-55-59 >ET-1</span> expression in bronchoepithelial cells from patients with chronic, stable <span class= disease  id= 9701415-7-133-139 >asthma</span>.	9701415	null	endothelin 1	C0004096	Asthma	Abnormality of the immune system; Abnormality of the respiratory system	C0004096	Asthma	Disease or Syndrome	D001249	Immune System Diseases ; Respiratory Tract Diseases	disease of anatomical entity	disease	null	disease	0.222380537127273	1998
EDN1	1906	AlteredExpression	BEFREE	Augmented epithelial <span class= gene  id= 17996929-0-21-33 >endothelin-1</span> expression in refractory <span class= disease  id= 17996929-0-59-65 >asthma</span>.	17996929	null	endothelin 1	C0004096	Asthma	Abnormality of the immune system; Abnormality of the respiratory system	C0004096	Asthma	Disease or Syndrome	D001249	Immune System Diseases ; Respiratory Tract Diseases	disease of anatomical entity	disease	null	disease	0.222380537127273	2007
EDN1	1906	AlteredExpression	BEFREE	When hydrocortisone (10(-6)M) was added to the culture medium of <span class= disease  id= 1443891-7-65-74 >asthmatic</span> bronchial epithelial cells for 48 h, the release of immunoreactive endothelin significantly decreased (p &lt; 0.025), but the numbers of cells expressing <span class= gene  id= 1443891-7-226-244 >preproendothelin 1</span> mRNA did not change to the same extent.	1443891	null	endothelin 1	C0004096	Asthma	Abnormality of the immune system; Abnormality of the respiratory system	C0004096	Asthma	Disease or Syndrome	D001249	Immune System Diseases ; Respiratory Tract Diseases	disease of anatomical entity	disease	null	disease	0.222380537127273	1992
SPINK5	11005	AlteredExpression	BEFREE	SPINK5 single-nucleotide polymorphisms (SNPs) and <span class= gene  id= 22570283-4-50-56 >SPINK5</span> expression levels were correlated with CRS without (CRSsNP) and with nasal polyps (CRSwNP), aspirin intolerance, <span class= disease  id= 22570283-4-170-176 >asthma</span>, and allergies.	22570283	enzyme modulator	serine peptidase inhibitor, Kazal type 5	C0004096	Asthma	Abnormality of the immune system; Abnormality of the respiratory system	C0004096	Asthma	Disease or Syndrome	D001249	Immune System Diseases ; Respiratory Tract Diseases	disease of anatomical entity	disease	null	disease	0.222278222812648	2012
ICAM1	3383	AlteredExpression	BEFREE	<span class= gene  id= 9731032-6-0-6 >ICAM-1</span> expression was significantly increased in bronchial epithelial cells from untreated <span class= disease  id= 9731032-6-91-101 >asthmatics</span>, but ICAM-1 was not expressed in those from steroid-dependent asthmatic patients.	9731032	cell adhesion molecule; signaling molecule	intercellular adhesion molecule 1	C0004096	Asthma	Abnormality of the immune system; Abnormality of the respiratory system	C0004096	Asthma	Disease or Syndrome	D001249	Immune System Diseases ; Respiratory Tract Diseases	disease of anatomical entity	disease	null	disease	0.218218247963749	1998
ICAM1	3383	AlteredExpression	BEFREE	Collectively, these observations provide new evidence demonstrating that activation of the CAM counterreceptor ligands <span class= gene  id= 10835320-7-119-125 >ICAM-1</span> and LFA-1, both of which are endogenously expressed in ASM cells, elicits autologously upregulated IL-5 release and associated changes in <span class= gene  id= 10835320-7-264-270 >ICAM-1</span> expression and agonist responsiveness in atopic <span class= disease  id= 10835320-7-319-328 >asthmatic</span> sensitized ASM.	10835320	cell adhesion molecule; signaling molecule	intercellular adhesion molecule 1	C0004096	Asthma	Abnormality of the immune system; Abnormality of the respiratory system	C0004096	Asthma	Disease or Syndrome	D001249	Immune System Diseases ; Respiratory Tract Diseases	disease of anatomical entity	disease	null	disease	0.218218247963749	2000
IL33	90865	AlteredExpression	BEFREE	Serum <span class= gene  id= 26107423-3-6-11 >IL-33</span> levels are increased in various diseases, such as atopic dermatitis, chronic hepatitis C infection, and <span class= disease  id= 26107423-3-116-122 >asthma</span>.	26107423	null	interleukin 33	C0004096	Asthma	Abnormality of the immune system; Abnormality of the respiratory system	C0004096	Asthma	Disease or Syndrome	D001249	Immune System Diseases ; Respiratory Tract Diseases	disease of anatomical entity	disease	null	disease	0.216836523017323	2016
IL33	90865	AlteredExpression	BEFREE	<span class= gene  id= 25278425-1-0-5 >IL-33</span> is a nuclear cytokine from the IL-1 family constitutively expressed in epithelial barrier tissues and lymphoid organs, which plays important roles in type-2 innate immunity and human <span class= disease  id= 25278425-1-189-195 >asthma</span>.	25278425	null	interleukin 33	C0004096	Asthma	Abnormality of the immune system; Abnormality of the respiratory system	C0004096	Asthma	Disease or Syndrome	D001249	Immune System Diseases ; Respiratory Tract Diseases	disease of anatomical entity	disease	null	disease	0.216836523017323	2014
IL33	90865	AlteredExpression	BEFREE	<span class= gene  id= 20689814-1-0-5 >IL-33</span> is a recently characterized IL-1 family cytokine and found to be expressed in inflammatory diseases, including severe <span class= disease  id= 20689814-1-124-130 >asthma</span> and inflammatory bowl disease.	20689814	null	interleukin 33	C0004096	Asthma	Abnormality of the immune system; Abnormality of the respiratory system	C0004096	Asthma	Disease or Syndrome	D001249	Immune System Diseases ; Respiratory Tract Diseases	disease of anatomical entity	disease	null	disease	0.216836523017323	2010
IL33	90865	AlteredExpression	BEFREE	In this study we demonstrate that both ICs and HDM induce expression of <span class= gene  id= 25088053-7-72-77 >IL-33</span>, a critical mediator in <span class= disease  id= 25088053-7-102-108 >asthma</span> pathogenesis and the differentiation of TH2 cells, in DCs.	25088053	null	interleukin 33	C0004096	Asthma	Abnormality of the immune system; Abnormality of the respiratory system	C0004096	Asthma	Disease or Syndrome	D001249	Immune System Diseases ; Respiratory Tract Diseases	disease of anatomical entity	disease	null	disease	0.216836523017323	2014
IL33	90865	AlteredExpression	BEFREE	Induced sputum levels of <span class= gene  id= 23855553-0-25-30 >IL-33</span> and soluble ST2 in young <span class= disease  id= 23855553-0-56-65 >asthmatic</span> children.	23855553	null	interleukin 33	C0004096	Asthma	Abnormality of the immune system; Abnormality of the respiratory system	C0004096	Asthma	Disease or Syndrome	D001249	Immune System Diseases ; Respiratory Tract Diseases	disease of anatomical entity	disease	null	disease	0.216836523017323	2014
IL33	90865	AlteredExpression	BEFREE	Expression of sDC OX40L and CCL17 mRNA was increased in <span class= disease  id= 25813919-9-56-65 >asthmatic</span> cases (P = .003 and P = .0001, respectively). sHBEC TSLP mRNA expression was strongly associated with sDC OX40L mRNA expression (R = 0.65, P = .001) and less strongly with sDC CCL17 mRNA expression. sHBEC <span class= gene  id= 25813919-9-271-275 >IL33</span> mRNA expression was associated with sDC OX40L mRNA expression (R = 0.42, P = .04) but not sDC CCL17 mRNA expression.	25813919	null	interleukin 33	C0004096	Asthma	Abnormality of the immune system; Abnormality of the respiratory system	C0004096	Asthma	Disease or Syndrome	D001249	Immune System Diseases ; Respiratory Tract Diseases	disease of anatomical entity	disease	null	disease	0.216836523017323	2014
IL33	90865	AlteredExpression	BEFREE	Finally, we showed that <span class= gene  id= 19841166-10-24-29 >IL-33</span> was more abundantly expressed in the lung epithelial cells of <span class= disease  id= 19841166-10-92-98 >asthma</span> patients than those from healthy controls, suggesting that <span class= gene  id= 19841166-10-158-163 >IL-33</span> may be involved in lung macrophage activation in clinical <span class= disease  id= 19841166-10-222-228 >asthma</span>.	19841166	null	interleukin 33	C0004096	Asthma	Abnormality of the immune system; Abnormality of the respiratory system	C0004096	Asthma	Disease or Syndrome	D001249	Immune System Diseases ; Respiratory Tract Diseases	disease of anatomical entity	disease	null	disease	0.216836523017323	2009
IL33	90865	AlteredExpression	BEFREE	Increased expression of <span class= gene  id= 19801525-0-24-29 >IL-33</span> in severe <span class= disease  id= 19801525-0-40-46 >asthma</span>: evidence of expression by airway smooth muscle cells.	19801525	null	interleukin 33	C0004096	Asthma	Abnormality of the immune system; Abnormality of the respiratory system	C0004096	Asthma	Disease or Syndrome	D001249	Immune System Diseases ; Respiratory Tract Diseases	disease of anatomical entity	disease	null	disease	0.216836523017323	2009
IL33	90865	AlteredExpression	BEFREE	Alternaria-derived serine protease activity drives <span class= gene  id= 24636086-0-51-56 >IL-33</span>-mediated <span class= disease  id= 24636086-0-66-72 >asthma</span> exacerbations.	24636086	null	interleukin 33	C0004096	Asthma	Abnormality of the immune system; Abnormality of the respiratory system	C0004096	Asthma	Disease or Syndrome	D001249	Immune System Diseases ; Respiratory Tract Diseases	disease of anatomical entity	disease	null	disease	0.216836523017323	2014
HLA-DQA1	3117	AlteredExpression	BEFREE	The cluster analysis of these DEGs showed that 4 genes, including human leukocyte antigen (<span class= gene  id= 24838153-3-91-99 >HLA-DQA1</span>), HLA-DRB4, integrin 3 (ITGB3) and killer cell lectin-like receptor subfamily F member 1 (KLRF1) were all significantly expressed in 3 groups, which were significantly enriched in <span class= disease  id= 24838153-3-280-286 >asthma</span>, T1D and intestinal immune network for IgA production pathway.	24838153	defense/immunity protein	major histocompatibility complex, class II, DQ alpha 1	C0004096	Asthma	Abnormality of the immune system; Abnormality of the respiratory system	C0004096	Asthma	Disease or Syndrome	D001249	Immune System Diseases ; Respiratory Tract Diseases	disease of anatomical entity	disease	null	disease	0.215592235433893	2015
PTGDR2	11251	AlteredExpression	BEFREE	Considering the fact that eosinophil infiltration is prominent in the upper and lower airways of aspirin exacerbated respiratory disease (AERD) compared to aspirin-tolerant <span class= disease  id= 19796209-3-173-179 >asthma</span> (ATA) patients, we hypothesized that activation of eosinophils via dysregulation of the <span class= gene  id= 19796209-3-268-273 >CRTH2</span> gene may play an important role and be an important marker for AERD.	19796209	receptor	prostaglandin D2 receptor 2	C0004096	Asthma	Abnormality of the immune system; Abnormality of the respiratory system	C0004096	Asthma	Disease or Syndrome	D001249	Immune System Diseases ; Respiratory Tract Diseases	disease of anatomical entity	disease	null	disease	0.21538302118431	2010
PTGDR2	11251	AlteredExpression	BEFREE	Asthma exacerbations, poor <span class= disease  id= 23506843-11-27-33 >asthma</span> control, and TH2 inflammatory markers were associated with higher PGD2, HPGDS, and <span class= gene  id= 23506843-11-117-122 >CRTH2</span> levels.	23506843	receptor	prostaglandin D2 receptor 2	C0004096	Asthma	Abnormality of the immune system; Abnormality of the respiratory system	C0004096	Asthma	Disease or Syndrome	D001249	Immune System Diseases ; Respiratory Tract Diseases	disease of anatomical entity	disease	null	disease	0.21538302118431	2013
PTGDR2	11251	AlteredExpression	BEFREE	D prostanoid receptor 2 (<span class= gene  id= 25312757-0-25-92 >chemoattractant receptor-homologous molecule expressed on TH2 cells</span>) protein expression in <span class= disease  id= 25312757-0-116-125 >asthmatic</span> patients and its effects on bronchial epithelial cells.	25312757	receptor	prostaglandin D2 receptor 2	C0004096	Asthma	Abnormality of the immune system; Abnormality of the respiratory system	C0004096	Asthma	Disease or Syndrome	D001249	Immune System Diseases ; Respiratory Tract Diseases	disease of anatomical entity	disease	null	disease	0.21538302118431	2014
CCL2	6347	AlteredExpression	BEFREE	We demonstrated that <span class= gene  id= 25765592-8-21-25 >CCL2</span> and IL-17 levels and the frequency of Th17 and Tc17 cells in lung tissues and bronchoalveolar lavage fluid increased in the <span class= disease  id= 25765592-8-150-156 >asthma</span> group compared with the normal control mice.	25765592	signaling molecule	C-C motif chemokine ligand 2	C0004096	Asthma	Abnormality of the immune system; Abnormality of the respiratory system	C0004096	Asthma	Disease or Syndrome	D001249	Immune System Diseases ; Respiratory Tract Diseases	disease of anatomical entity	disease	null	disease	0.214782410458571	2014
CCL2	6347	AlteredExpression	BEFREE	The mean serum <span class= gene  id= 16801146-5-15-20 >MCP-1</span> level was significantly lower in the <span class= disease  id= 16801146-5-58-67 >asthmatic</span> than in the control children.	16801146	signaling molecule	C-C motif chemokine ligand 2	C0004096	Asthma	Abnormality of the immune system; Abnormality of the respiratory system	C0004096	Asthma	Disease or Syndrome	D001249	Immune System Diseases ; Respiratory Tract Diseases	disease of anatomical entity	disease	null	disease	0.214782410458571	2006
CCL2	6347	AlteredExpression	BEFREE	We conclude that cells contained in the bronchial secretions from <span class= disease  id= 14968124-7-66-76 >asthmatics</span> express higher amounts of mRNA for MMP-1 and TIMP-1, perhaps related to an increased expression of <span class= gene  id= 14968124-7-176-181 >MCP-1</span>, which might contribute to the extracellular matrix changes observed during airway remodelling.	14968124	signaling molecule	C-C motif chemokine ligand 2	C0004096	Asthma	Abnormality of the immune system; Abnormality of the respiratory system	C0004096	Asthma	Disease or Syndrome	D001249	Immune System Diseases ; Respiratory Tract Diseases	disease of anatomical entity	disease	null	disease	0.214782410458571	2004
CAT	847	AlteredExpression	BEFREE	Although <span class= gene  id= 9038914-2-9-17 >catalase</span> and glutathione peroxidase in bronchial epithelium of <span class= disease  id= 9038914-2-72-82 >asthmatics</span> were similar to control SOD activity in <span class= disease  id= 9038914-2-123-133 >asthmatics</span> not on inhaled corticosteroid (-CS) was lower than <span class= disease  id= 9038914-2-185-195 >asthmatics</span> on inhaled corticosteroid (+CS) and controls.	9038914	oxidoreductase	catalase	C0004096	Asthma	Abnormality of the immune system; Abnormality of the respiratory system	C0004096	Asthma	Disease or Syndrome	D001249	Immune System Diseases ; Respiratory Tract Diseases	disease of anatomical entity	disease	null	disease	0.213250719445235	1997
ADA	100	AlteredExpression	LHGDN	The activity of <span class=gene id=12774669>ADA</span> was determined in lymphocytes, esoinophils and blood serum in patients with <span class=disease id=12774669>bronchial asthma</span>.	12774669	hydrolase	adenosine deaminase	C0004096	Asthma	Abnormality of the immune system; Abnormality of the respiratory system	C0004096	Asthma	Disease or Syndrome	D001249	Immune System Diseases ; Respiratory Tract Diseases	disease of anatomical entity	disease	null	disease	0.21105290517153	2003
TNC	3371	AlteredExpression	BEFREE	Consistently, <span class= gene  id= 21354146-5-14-24 >tenascin-C</span> expression in vivo was found to correlate with fibrin deposition in several diseases associated with <span class= gene  id= 21354146-5-126-136 >tenascin-C</span> overexpression such as fibrosis, <span class= disease  id= 21354146-5-170-176 >asthma</span> and cancer.	21354146	signaling molecule	tenascin C	C0004096	Asthma	Abnormality of the immune system; Abnormality of the respiratory system	C0004096	Asthma	Disease or Syndrome	D001249	Immune System Diseases ; Respiratory Tract Diseases	disease of anatomical entity	disease	null	disease	0.210345394510833	2011
TNC	3371	AlteredExpression	BEFREE	Taken together, these data demonstrate that TNF-alpha increases MMP-9 and <span class= gene  id= 14734780-12-74-82 >tenascin</span> expression in bronchial fibroblasts via the transcription factor Ets-1, and suggest a role for Ets-1 in airway remodeling in <span class= disease  id= 14734780-12-208-214 >asthma</span>.	14734780	signaling molecule	tenascin C	C0004096	Asthma	Abnormality of the immune system; Abnormality of the respiratory system	C0004096	Asthma	Disease or Syndrome	D001249	Immune System Diseases ; Respiratory Tract Diseases	disease of anatomical entity	disease	null	disease	0.210345394510833	2004
TNC	3371	AlteredExpression	BEFREE	OVA-challenged WT mice showed allergic inflammation and <span class= disease  id= 21205293-7-56-59 >AHR</span> in the airways along with increased expression of TNF-&alpha;, IFN-&gamma;, IL-4 and <span class= gene  id= 21205293-7-133-143 >tenascin-C</span> in the lungs.	21205293	signaling molecule	tenascin C	C0004096	Asthma	Abnormality of the immune system; Abnormality of the respiratory system	C0004096	Asthma	Disease or Syndrome	D001249	Immune System Diseases ; Respiratory Tract Diseases	disease of anatomical entity	disease	null	disease	0.210345394510833	2011
ARG1	383	AlteredExpression	BEFREE	Microarray analysis of the expression profiles of lung tissue in two murine models of <span class= disease  id= 12813015-1-86-92 >asthma</span> revealed high levels of <span class= gene  id= 12813015-1-117-127 >arginase I</span> and arginase II activity, in association with IL-4 and IL-13 overexpression, suggesting that arginine pathways are critical in the pathogenesis of <span class= disease  id= 12813015-1-275-281 >asthma</span>.	12813015	hydrolase	arginase 1	C0004096	Asthma	Abnormality of the immune system; Abnormality of the respiratory system	C0004096	Asthma	Disease or Syndrome	D001249	Immune System Diseases ; Respiratory Tract Diseases	disease of anatomical entity	disease	null	disease	0.210294237353521	2003
ARG1	383	AlteredExpression	BEFREE	The expression of <span class= gene  id= 20382750-1-18-28 >arginase I</span> has been a focus of research into the pathogenesis of experimental <span class= disease  id= 20382750-1-96-102 >asthma</span>, because arginase deprives nitric oxide synthase (NOS) of arginine and therefore participates in the attenuation of bronchodilators such as nitric oxide (NO).	20382750	hydrolase	arginase 1	C0004096	Asthma	Abnormality of the immune system; Abnormality of the respiratory system	C0004096	Asthma	Disease or Syndrome	D001249	Immune System Diseases ; Respiratory Tract Diseases	disease of anatomical entity	disease	null	disease	0.210294237353521	2010
ARG1	383	AlteredExpression	BEFREE	We show here that T(h)2 cell-mediated inflammation in murine <span class= disease  id= 24150243-4-61-67 >asthma</span> models induces the expression of some markers of alternatively activated macrophage such as <span class= gene  id= 24150243-4-160-170 >arginase 1</span> and resistin-like molecule-&alpha; in iDCs by a mechanism depending on the intrinsic expression of STAT6.	24150243	hydrolase	arginase 1	C0004096	Asthma	Abnormality of the immune system; Abnormality of the respiratory system	C0004096	Asthma	Disease or Syndrome	D001249	Immune System Diseases ; Respiratory Tract Diseases	disease of anatomical entity	disease	null	disease	0.210294237353521	2014
HLA-G	3135	AlteredExpression	BEFREE	Abnormal <span class= gene  id= 23732778-2-9-14 >HLA-G</span> expression is present in various diseases, such as renal cell carcinoma, <span class= disease  id= 23732778-2-88-94 >asthma</span> and classical Hodgkin's lymphoma.	23732778	defense/immunity protein; receptor	major histocompatibility complex, class I, G	C0004096	Asthma	Abnormality of the immune system; Abnormality of the respiratory system	C0004096	Asthma	Disease or Syndrome	D001249	Immune System Diseases ; Respiratory Tract Diseases	disease of anatomical entity	disease	null	disease	0.209744783785095	2013
HLA-G	3135	AlteredExpression	BEFREE	Maternal <span class= disease  id= 23534973-0-9-15 >asthma</span> and microRNA regulation of soluble <span class= gene  id= 23534973-0-51-56 >HLA-G</span> in the airway.	23534973	defense/immunity protein; receptor	major histocompatibility complex, class I, G	C0004096	Asthma	Abnormality of the immune system; Abnormality of the respiratory system	C0004096	Asthma	Disease or Syndrome	D001249	Immune System Diseases ; Respiratory Tract Diseases	disease of anatomical entity	disease	null	disease	0.209744783785095	2013
PLAU	5328	AlteredExpression	LHGDN	Constitutive uPA primes, and exogenous uPA can activate, airway eosinophil adhesion following segmental allergen challenge and that increased uPA expression may be a mechanism of increased eosinophil infiltration and function in asthma.	16728704	protease; hydrolase	plasminogen activator, urokinase	C0004096	Asthma	Abnormality of the immune system; Abnormality of the respiratory system	C0004096	Asthma	Disease or Syndrome	D001249	Immune System Diseases ; Respiratory Tract Diseases	disease of anatomical entity	disease	null	disease	0.208748190962867	2006
PLAU	5328	AlteredExpression	LHGDN	Induced-sputum innate immune factor levels discriminate inflammatory changes in cystic fibrosis, COPD, and asthma.	16236890	protease; hydrolase	plasminogen activator, urokinase	C0004096	Asthma	Abnormality of the immune system; Abnormality of the respiratory system	C0004096	Asthma	Disease or Syndrome	D001249	Immune System Diseases ; Respiratory Tract Diseases	disease of anatomical entity	disease	null	disease	0.208748190962867	2005
ARG2	384	AlteredExpression	BEFREE	The elevated <span class= gene  id= 22712848-12-13-24 >arginase II</span> activity and expression may be a mechanism underlying adverse effects induced by PM exposure in <span class= disease  id= 22712848-12-121-127 >asthma</span> patients.	22712848	hydrolase	arginase 2	C0004096	Asthma	Abnormality of the immune system; Abnormality of the respiratory system	C0004096	Asthma	Disease or Syndrome	D001249	Immune System Diseases ; Respiratory Tract Diseases	disease of anatomical entity	disease	null	disease	0.207286598104494	2012
ARG2	384	AlteredExpression	BEFREE	Microarray analysis of the expression profiles of lung tissue in two murine models of <span class= disease  id= 12813015-1-86-92 >asthma</span> revealed high levels of arginase I and <span class= gene  id= 12813015-1-132-143 >arginase II</span> activity, in association with IL-4 and IL-13 overexpression, suggesting that arginine pathways are critical in the pathogenesis of <span class= disease  id= 12813015-1-275-281 >asthma</span>.	12813015	hydrolase	arginase 2	C0004096	Asthma	Abnormality of the immune system; Abnormality of the respiratory system	C0004096	Asthma	Disease or Syndrome	D001249	Immune System Diseases ; Respiratory Tract Diseases	disease of anatomical entity	disease	null	disease	0.207286598104494	2003
ARG2	384	AlteredExpression	BEFREE	To determine the relationships of iNOS expression/activation and <span class= gene  id= 22092728-3-65-75 >arginase 2</span> expression with <span class= disease  id= 22092728-3-92-98 >asthma</span> severity, FeNO, nitrotyrosine (NT) and eosinophilic inflammation.	22092728	hydrolase	arginase 2	C0004096	Asthma	Abnormality of the immune system; Abnormality of the respiratory system	C0004096	Asthma	Disease or Syndrome	D001249	Immune System Diseases ; Respiratory Tract Diseases	disease of anatomical entity	disease	null	disease	0.207286598104494	2011
ALDH2	217	AlteredExpression	BEFREE	Approximately half the <span class= disease  id= 17590989-6-23-32 >asthmatic</span> subjects developed bronchoconstriction with concomitant increases in blood acetaldehyde and histamine, which was associated with genetically reduced<span class= gene  id= 17590989-6-181-186 >ALDH2</span> activities.	17590989	oxidoreductase	aldehyde dehydrogenase 2 family (mitochondrial)	C0004096	Asthma	Abnormality of the immune system; Abnormality of the respiratory system	C0004096	Asthma	Disease or Syndrome	D001249	Immune System Diseases ; Respiratory Tract Diseases	disease of anatomical entity	disease	null	disease	0.206462417751855	2008
AREG	374	AlteredExpression	BEFREE	<span class= gene  id= 15696083-9-0-12 >Amphiregulin</span> was also expressed in human lung mast cells from patients with <span class= disease  id= 15696083-9-76-82 >asthma</span>, as demonstrated by means of double-immunofluorescence staining.	15696083	signaling molecule	amphiregulin	C0004096	Asthma	Abnormality of the immune system; Abnormality of the respiratory system	C0004096	Asthma	Disease or Syndrome	D001249	Immune System Diseases ; Respiratory Tract Diseases	disease of anatomical entity	disease	null	disease	0.204655999954305	2005
AREG	374	AlteredExpression	BEFREE	IL-3 can induce basophils to express high levels of <span class= gene  id= 21036386-14-52-64 >amphiregulin</span>, which may contribute to tissue remodeling during type 2 immune responses such as <span class= disease  id= 21036386-14-147-153 >asthma</span>.	21036386	signaling molecule	amphiregulin	C0004096	Asthma	Abnormality of the immune system; Abnormality of the respiratory system	C0004096	Asthma	Disease or Syndrome	D001249	Immune System Diseases ; Respiratory Tract Diseases	disease of anatomical entity	disease	null	disease	0.204655999954305	2010
AREG	374	AlteredExpression	BEFREE	<span class= gene  id= 22247333-4-0-12 >Amphiregulin</span> and HB-EGF were expressed in airway epithelium of patients with <span class= disease  id= 22247333-4-77-83 >asthma</span>.	22247333	signaling molecule	amphiregulin	C0004096	Asthma	Abnormality of the immune system; Abnormality of the respiratory system	C0004096	Asthma	Disease or Syndrome	D001249	Immune System Diseases ; Respiratory Tract Diseases	disease of anatomical entity	disease	null	disease	0.204655999954305	2012
