POTEF	728378	AlteredExpression	BEFREE	The median (IQR) T-bet expression after normalization with <span class= gene  id= 17302903-7-59-69 >beta-actin</span> was suppressed in <span class= disease  id= 17302903-7-88-98 >asthmatics</span> versus controls [<span class= disease  id= 17302903-7-116-126 >asthmatics</span> 0 x 71 (0 x 59) versus controls 1 x 07 (1 x 14), P=0 x 03].The median (IQR) of plasma RANTES was elevated, whereas IP-10 was suppressed in <span class= disease  id= 17302903-7-266-276 >asthmatics</span> versus controls (RANTES: 13658 x 0 (13673 x 3) versus 6299 x 5 (19407 x 8) pg/ml, P=0 x 03; IP-10: 1047 x 6 (589 x 8) versus 1306 x 4 (759 x 9) pg/ml, P=0 x 001).	17302903	null	POTE ankyrin domain family member F	C0004096	Asthma	Abnormality of the immune system; Abnormality of the respiratory system	C0004096	Asthma	Disease or Syndrome	D001249	Immune System Diseases ; Respiratory Tract Diseases	disease of anatomical entity	disease	null	disease	0.001098907136852	2007
CD38	952	AlteredExpression	BEFREE	Differential induction of <span class= gene  id= 20693316-0-26-30 >CD38</span> expression by TNF-{alpha} in <span class= disease  id= 20693316-0-60-69 >asthmatic</span> airway smooth muscle cells.	20693316	lyase; hydrolase	CD38 molecule	C0004096	Asthma	Abnormality of the immune system; Abnormality of the respiratory system	C0004096	Asthma	Disease or Syndrome	D001249	Immune System Diseases ; Respiratory Tract Diseases	disease of anatomical entity	disease	null	disease	0.001098907136852	2011
CD38	952	AlteredExpression	BEFREE	In HASM cells, regulation of <span class= gene  id= 22556157-13-29-33 >CD38</span> expression occurs by specific class I PI3K isoforms, independent of NF-&kappa;B or AP-1 activation, and PI3K signaling may <span class= negexp >not be involved</span> in the differential elevation of <span class= gene  id= 22556157-13-200-204 >CD38</span> in <span class= disease  id= 22556157-13-208-217 >asthmatic</span> HASM cells.	22556157	lyase; hydrolase	CD38 molecule	C0004096	Asthma	Abnormality of the immune system; Abnormality of the respiratory system	C0004096	Asthma	Disease or Syndrome	D001249	Immune System Diseases ; Respiratory Tract Diseases	disease of anatomical entity	disease	null	disease	0.001098907136852	2012
CEL	1056	AlteredExpression	BEFREE	Cyclosporin A, apoptosis of <span class= gene  id= 12952249-0-28-31 >BAL</span> T-cells and expression of Bcl-2 in <span class= disease  id= 12952249-0-67-77 >asthmatics</span>.	12952249	hydrolase	carboxyl ester lipase	C0004096	Asthma	Abnormality of the immune system; Abnormality of the respiratory system	C0004096	Asthma	Disease or Syndrome	D001249	Immune System Diseases ; Respiratory Tract Diseases	disease of anatomical entity	disease	null	disease	0.000824180352639	2004
CEL	1056	AlteredExpression	BEFREE	Activation of peripheral blood CD4 but not CD8 T-LC and a Th2-type pattern of elevated cytokine mRNA expression in <span class= gene  id= 7742019-2-115-118 >BAL</span> fluid T-LC have been observed in <span class= disease  id= 7742019-2-152-162 >asthmatics</span>, but the principal source (CD4 or CD8 T-LC) of these cytokines is unknown.	7742019	hydrolase	carboxyl ester lipase	C0004096	Asthma	Abnormality of the immune system; Abnormality of the respiratory system	C0004096	Asthma	Disease or Syndrome	D001249	Immune System Diseases ; Respiratory Tract Diseases	disease of anatomical entity	disease	null	disease	0.000824180352639	1995
SLC27A5	10998	AlteredExpression	BEFREE	Activation of peripheral blood CD4 but not CD8 T-LC and a Th2-type pattern of elevated cytokine mRNA expression in <span class= gene  id= 7742019-2-115-118 >BAL</span> fluid T-LC have been observed in <span class= disease  id= 7742019-2-152-162 >asthmatics</span>, but the principal source (CD4 or CD8 T-LC) of these cytokines is unknown.	7742019	ligase	solute carrier family 27 member 5	C0004096	Asthma	Abnormality of the immune system; Abnormality of the respiratory system	C0004096	Asthma	Disease or Syndrome	D001249	Immune System Diseases ; Respiratory Tract Diseases	disease of anatomical entity	disease	null	disease	0.000824180352639	1995
SLC27A5	10998	AlteredExpression	BEFREE	Cyclosporin A, apoptosis of <span class= gene  id= 12952249-0-28-31 >BAL</span> T-cells and expression of Bcl-2 in <span class= disease  id= 12952249-0-67-77 >asthmatics</span>.	12952249	ligase	solute carrier family 27 member 5	C0004096	Asthma	Abnormality of the immune system; Abnormality of the respiratory system	C0004096	Asthma	Disease or Syndrome	D001249	Immune System Diseases ; Respiratory Tract Diseases	disease of anatomical entity	disease	null	disease	0.000824180352639	2004
CCR4	1233	AlteredExpression	BEFREE	Activation of <span class= gene  id= 20099827-2-14-18 >CCR4</span> by CKLF1 plays an important role in diseases such as <span class= disease  id= 20099827-2-72-78 >asthma</span> and multiple sclerosis.	20099827	cell adhesion molecule; phosphatase; hydrolase; defense/immunity protein; receptor	C-C motif chemokine receptor 4	C0004096	Asthma	Abnormality of the immune system; Abnormality of the respiratory system	C0004096	Asthma	Disease or Syndrome	D001249	Immune System Diseases ; Respiratory Tract Diseases	disease of anatomical entity	disease	null	disease	0.000824180352639	2010
CPA3	1359	AlteredExpression	BEFREE	IEMC density was 2-fold higher than normal in subjects with T(H)2-high <span class= disease  id= 20451039-8-71-77 >asthma</span> compared with that seen in subjects with T(H)2-low <span class= disease  id= 20451039-8-129-135 >asthma</span> or healthy control subjects (P = .015 for both comparisons), and these cells were characterized by expression of tryptases and <span class= gene  id= 20451039-8-263-267 >CPA3</span> but not chymase.	20451039	protease; hydrolase	carboxypeptidase A3	C0004096	Asthma	Abnormality of the immune system; Abnormality of the respiratory system	C0004096	Asthma	Disease or Syndrome	D001249	Immune System Diseases ; Respiratory Tract Diseases	disease of anatomical entity	disease	null	disease	0.000824180352639	2010
CPA3	1359	AlteredExpression	BEFREE	Genes related to epithelial repair and mast cell infiltration including beta-tryptase and <span class= gene  id= 20052409-6-90-109 >carboxypeptidase A3</span> were upregulated by exercise challenge in the <span class= disease  id= 20052409-6-156-162 >asthma</span> group with EIB.	20052409	protease; hydrolase	carboxypeptidase A3	C0004096	Asthma	Abnormality of the immune system; Abnormality of the respiratory system	C0004096	Asthma	Disease or Syndrome	D001249	Immune System Diseases ; Respiratory Tract Diseases	disease of anatomical entity	disease	null	disease	0.000824180352639	2009
DECR1	1666	AlteredExpression	BEFREE	Changes in <span class= gene  id= 22982469-0-11-16 >NADPH</span> oxidase mRNA level can be detected in blood at inhaled corticosteroid treated <span class= disease  id= 22982469-0-95-104 >asthmatic</span> children.	22982469	oxidoreductase	2,4-dienoyl-CoA reductase 1	C0004096	Asthma	Abnormality of the immune system; Abnormality of the respiratory system	C0004096	Asthma	Disease or Syndrome	D001249	Immune System Diseases ; Respiratory Tract Diseases	disease of anatomical entity	disease	null	disease	0.000824180352639	2012
DECR1	1666	AlteredExpression	BEFREE	Mice lacking functional <span class= gene  id= 23884469-5-24-29 >NADPH</span> oxidases due to knockout of p47 and mice with epithelial-targeted transgenic expression of a CaMKII inhibitory peptide or wild-type mice treated with inhaled KN-93, an experimental small-molecule CaMKII antagonist, were protected against increases in ICl, MUC5AC expression, and <span class= disease  id= 23884469-5-309-331 >airway hyperreactivity</span> to inhaled methacholine.	23884469	oxidoreductase	2,4-dienoyl-CoA reductase 1	C0004096	Asthma	Abnormality of the immune system; Abnormality of the respiratory system	C0004096	Asthma	Disease or Syndrome	D001249	Immune System Diseases ; Respiratory Tract Diseases	disease of anatomical entity	disease	null	disease	0.000824180352639	2014
ABCA1	19	AlteredExpression	BEFREE	<span class= gene  id= 9105087-0-0-14 >Membrane-bound</span> and soluble alpha IL-5 receptor mRNA in the bronchial mucosa of atopic and nonatopic <span class= disease  id= 9105087-0-100-110 >asthmatics</span>.	9105087	transporter	ATP binding cassette subfamily A member 1	C0004096	Asthma	Abnormality of the immune system; Abnormality of the respiratory system	C0004096	Asthma	Disease or Syndrome	D001249	Immune System Diseases ; Respiratory Tract Diseases	disease of anatomical entity	disease	null	disease	0.000824180352639	1997
ABCA1	19	AlteredExpression	BEFREE	These findings suggest that <span class= gene  id= 24813055-8-28-33 >ABCA1</span> expressed by vascular endothelial cells and alveolar macrophages may play important roles in attenuating the severity of neutrophilic airway inflammation in <span class= disease  id= 24813055-8-191-197 >asthma</span>.	24813055	transporter	ATP binding cassette subfamily A member 1	C0004096	Asthma	Abnormality of the immune system; Abnormality of the respiratory system	C0004096	Asthma	Disease or Syndrome	D001249	Immune System Diseases ; Respiratory Tract Diseases	disease of anatomical entity	disease	null	disease	0.000824180352639	2015
FCGR3B	2215	AlteredExpression	BEFREE	Finally we showed that human CD14(+)<span class= gene  id= 24358127-9-36-40 >CD16</span>(+) intermediate monocytes, which are found in increased numbers in patients with allergies and <span class= disease  id= 24358127-9-136-152 >bronchial asthma</span>, expressed high levels of miR-124 and exhibited other properties of M2-like cells.	24358127	cell adhesion molecule	Fc fragment of IgG receptor IIIb	C0004096	Asthma	Abnormality of the immune system; Abnormality of the respiratory system	C0004096	Asthma	Disease or Syndrome	D001249	Immune System Diseases ; Respiratory Tract Diseases	disease of anatomical entity	disease	null	disease	0.000824180352639	2013
AKR1B1	231	AlteredExpression	BEFREE	<span class= gene  id= 19752229-0-0-16 >Aldose reductase</span> inhibition suppresses the expression of Th2 cytokines and airway inflammation in ovalbumin-induced <span class= disease  id= 19752229-0-116-122 >asthma</span> in mice.	19752229	oxidoreductase	aldo-keto reductase family 1 member B	C0004096	Asthma	Abnormality of the immune system; Abnormality of the respiratory system	C0004096	Asthma	Disease or Syndrome	D001249	Immune System Diseases ; Respiratory Tract Diseases	disease of anatomical entity	disease	null	disease	0.000824180352639	2009
GAPDH	2597	AlteredExpression	BEFREE	The expression levels of the beta-actin and <span class= gene  id= 18417509-7-44-84 >glyceraldehyde-3-phosphate dehydrogenase</span> genes were significantly different between the three groups of patients, with atopic <span class= disease  id= 18417509-7-170-180 >asthmatics</span> showing the highest expression levels for both genes.	18417509	oxidoreductase	glyceraldehyde-3-phosphate dehydrogenase	C0004096	Asthma	Abnormality of the immune system; Abnormality of the respiratory system	C0004096	Asthma	Disease or Syndrome	D001249	Immune System Diseases ; Respiratory Tract Diseases	disease of anatomical entity	disease	null	disease	0.000824180352639	2009
GAPDH	2597	AlteredExpression	BEFREE	beta-Actin and <span class= gene  id= 12200519-0-15-20 >GAPDH</span> housekeeping gene expression in <span class= disease  id= 12200519-0-53-62 >asthmatic</span> airways is variable and not suitable for normalising mRNA levels.	12200519	oxidoreductase	glyceraldehyde-3-phosphate dehydrogenase	C0004096	Asthma	Abnormality of the immune system; Abnormality of the respiratory system	C0004096	Asthma	Disease or Syndrome	D001249	Immune System Diseases ; Respiratory Tract Diseases	disease of anatomical entity	disease	null	disease	0.000824180352639	2002
GAPDH	2597	AlteredExpression	BEFREE	Using quantitative polymerase chain reaction analysis, we determined the messenger RNA (mRNA) expression of eotaxin, eotaxin-2, and eotaxin-3 relative to <span class= gene  id= 11415932-3-154-159 >GAPDH</span> mRNA expression in bronchial biopsies and bronchoalveolar lavage fluid (BALF) cells obtained from subjects with mild <span class= disease  id= 11415932-3-277-283 >asthma</span>, asthmatic subjects 24 h after allergen challenge, and normal control subjects.	11415932	oxidoreductase	glyceraldehyde-3-phosphate dehydrogenase	C0004096	Asthma	Abnormality of the immune system; Abnormality of the respiratory system	C0004096	Asthma	Disease or Syndrome	D001249	Immune System Diseases ; Respiratory Tract Diseases	disease of anatomical entity	disease	null	disease	0.000824180352639	2001
TIPARP	25976	AlteredExpression	BEFREE	<span class= gene  id= 21276008-0-0-6 >PARP-1</span> deficiency blocks IL-5 expression through calpain-dependent degradation of STAT-6 in a murine <span class= disease  id= 21276008-0-101-107 >asthma</span> model.	21276008	nucleic acid binding	TCDD inducible poly(ADP-ribose) polymerase	C0004096	Asthma	Abnormality of the immune system; Abnormality of the respiratory system	C0004096	Asthma	Disease or Syndrome	D001249	Immune System Diseases ; Respiratory Tract Diseases	disease of anatomical entity	disease	null	disease	0.000824180352639	2011
TIPARP	25976	AlteredExpression	BEFREE	In the present study, we provide evidence for the first time that <span class= gene  id= 26205779-10-66-72 >PARP-1</span> is activated in human <span class= disease  id= 26205779-10-95-101 >asthma</span> and that its inhibition is effective in blocking established <span class= disease  id= 26205779-10-163-169 >asthma</span> in mice.	26205779	nucleic acid binding	TCDD inducible poly(ADP-ribose) polymerase	C0004096	Asthma	Abnormality of the immune system; Abnormality of the respiratory system	C0004096	Asthma	Disease or Syndrome	D001249	Immune System Diseases ; Respiratory Tract Diseases	disease of anatomical entity	disease	null	disease	0.000824180352639	2015
HSPA4	3308	AlteredExpression	BEFREE	In addition, increased circulating <span class= gene  id= 19821156-15-35-40 >Hsp70</span> levels observed in <span class= disease  id= 19821156-15-60-69 >asthmatic</span> pregnant patients might play a connecting role in the pathomechanism of <span class= disease  id= 19821156-15-142-151 >asthmatic</span> inflammation and obstetrical/perinatal complications.	19821156	null	heat shock protein family A (Hsp70) member 4	C0004096	Asthma	Abnormality of the immune system; Abnormality of the respiratory system	C0004096	Asthma	Disease or Syndrome	D001249	Immune System Diseases ; Respiratory Tract Diseases	disease of anatomical entity	disease	null	disease	0.000824180352639	2009
HSPA4	3308	AlteredExpression	BEFREE	Expression of <span class= gene  id= 11022984-8-14-19 >HSP70</span> gene in PBMC of <span class= disease  id= 11022984-8-36-45 >asthmatic</span> and chronic bronchitis patients was different, indicating that HSP, especially <span class= gene  id= 11022984-8-125-130 >HSP70</span>, might be involved in the pathogenesis of <span class= disease  id= 11022984-8-173-179 >asthma</span>.	11022984	null	heat shock protein family A (Hsp70) member 4	C0004096	Asthma	Abnormality of the immune system; Abnormality of the respiratory system	C0004096	Asthma	Disease or Syndrome	D001249	Immune System Diseases ; Respiratory Tract Diseases	disease of anatomical entity	disease	null	disease	0.000824180352639	2001
FAS	355	AlteredExpression	BEFREE	<span class= gene  id= 11207646-8-0-3 >FAS</span> and FASL were not differentially expressed, but FAST kinase was over-expressed in AN and <span class= disease  id= 11207646-8-93-95 >AA</span>.	11207646	receptor	Fas cell surface death receptor	C0004096	Asthma	Abnormality of the immune system; Abnormality of the respiratory system	C0004096	Asthma	Disease or Syndrome	D001249	Immune System Diseases ; Respiratory Tract Diseases	disease of anatomical entity	disease	null	disease	0.000824180352639	2001
FAS	355	AlteredExpression	BEFREE	It has been suggested that expression of the <span class= gene  id= 9761749-3-45-48 >Fas</span> receptor and its ligand (FasL) in airway epithelium may modulate the inflammatory response commonly found in <span class= disease  id= 9761749-3-158-167 >asthmatic</span> lungs.	9761749	receptor	Fas cell surface death receptor	C0004096	Asthma	Abnormality of the immune system; Abnormality of the respiratory system	C0004096	Asthma	Disease or Syndrome	D001249	Immune System Diseases ; Respiratory Tract Diseases	disease of anatomical entity	disease	null	disease	0.000824180352639	1998
LGALS9	3965	AlteredExpression	BEFREE	Reduced expression of galectin-1 and <span class= gene  id= 23121677-0-37-47 >galectin-9</span> by leucocytes in <span class= disease  id= 23121677-0-65-71 >asthma</span> patients.	23121677	cell adhesion molecule; signaling molecule	galectin 9	C0004096	Asthma	Abnormality of the immune system; Abnormality of the respiratory system	C0004096	Asthma	Disease or Syndrome	D001249	Immune System Diseases ; Respiratory Tract Diseases	disease of anatomical entity	disease	null	disease	0.000824180352639	2013
MIR155	406947	AlteredExpression	BEFREE	Cyclooxygenase-2 and <span class= gene  id= 25180620-0-21-33 >microRNA-155</span> expression are elevated in <span class= disease  id= 25180620-0-61-70 >asthmatic</span> airway smooth muscle cells.	25180620	null	microRNA 155	C0004096	Asthma	Abnormality of the immune system; Abnormality of the respiratory system	C0004096	Asthma	Disease or Syndrome	D001249	Immune System Diseases ; Respiratory Tract Diseases	disease of anatomical entity	disease	null	disease	0.000824180352639	2016
KITLG	4254	AlteredExpression	BEFREE	In asthmatic patients treated with glucocorticoids, a significant decrease of SCF mRNA, protein levels and mast cell numbers was observed as compared with untreated <span class= disease  id= 16499642-9-165-174 >asthmatic</span> patients (1.1 pg/microg mRNA; 62.0+/-10.3 pg/mL <span class= gene  id= 16499642-9-223-226 >SCF</span> protein and 39+/-13 mast cells/mm(2); P&lt;0.05), reaching levels comparable to those of the control group.	16499642	cell adhesion molecule; signaling molecule	KIT ligand	C0004096	Asthma	Abnormality of the immune system; Abnormality of the respiratory system	C0004096	Asthma	Disease or Syndrome	D001249	Immune System Diseases ; Respiratory Tract Diseases	disease of anatomical entity	disease	null	disease	0.000824180352639	2006
COX1	4512	AlteredExpression	BEFREE	Our aim was to investigate the expression of <span class= gene  id= 17622692-3-45-50 >COX-1</span> and COX-2 mRNA in primary human bronchial epithelial cells (HBEC) isolated from <span class= disease  id= 17622692-3-131-141 >asthmatics</span> and non-<span class= disease  id= 17622692-3-150-160 >asthmatics</span>.	17622692	oxidoreductase	cytochrome c oxidase subunit I	C0004096	Asthma	Abnormality of the immune system; Abnormality of the respiratory system	C0004096	Asthma	Disease or Syndrome	D001249	Immune System Diseases ; Respiratory Tract Diseases	disease of anatomical entity	disease	null	disease	0.000824180352639	2007
COX1	4512	AlteredExpression	BEFREE	<span class= gene  id= 18753249-0-0-5 >COX-1</span>, and not COX-2 activity, regulates airway function: relevance to aspirin-sensitive <span class= disease  id= 18753249-0-89-95 >asthma</span>.	18753249	oxidoreductase	cytochrome c oxidase subunit I	C0004096	Asthma	Abnormality of the immune system; Abnormality of the respiratory system	C0004096	Asthma	Disease or Syndrome	D001249	Immune System Diseases ; Respiratory Tract Diseases	disease of anatomical entity	disease	null	disease	0.000824180352639	2008
COX1	4512	AlteredExpression	BEFREE	The immunosuppressive activity of PMN-MDSCs was diminished in both allergen-challenged <span class= gene  id= 24948368-11-87-92 >COX-1</span> KO mice and patients with AIA, probably through an EP4-mediated signaling pathway, indicating that activation of PMN-MDSCs might be a promising therapeutic strategy for <span class= disease  id= 24948368-11-262-268 >asthma</span>, particularly AIA.	24948368	oxidoreductase	cytochrome c oxidase subunit I	C0004096	Asthma	Abnormality of the immune system; Abnormality of the respiratory system	C0004096	Asthma	Disease or Syndrome	D001249	Immune System Diseases ; Respiratory Tract Diseases	disease of anatomical entity	disease	null	disease	0.000824180352639	2014
CPA4	51200	AlteredExpression	BEFREE	Genes related to epithelial repair and mast cell infiltration including beta-tryptase and <span class= gene  id= 20052409-6-90-109 >carboxypeptidase A3</span> were upregulated by exercise challenge in the <span class= disease  id= 20052409-6-156-162 >asthma</span> group with EIB.	20052409	protease; hydrolase	carboxypeptidase A4	C0004096	Asthma	Abnormality of the immune system; Abnormality of the respiratory system	C0004096	Asthma	Disease or Syndrome	D001249	Immune System Diseases ; Respiratory Tract Diseases	disease of anatomical entity	disease	null	disease	0.000824180352639	2009
CPA4	51200	AlteredExpression	BEFREE	Previously, we found that mast cell tryptases and <span class= gene  id= 20451039-1-50-69 >carboxypeptidase A3</span> (CPA3) are differentially expressed in the airway epithelium in <span class= disease  id= 20451039-1-134-143 >asthmatic</span> subjects.	20451039	protease; hydrolase	carboxypeptidase A4	C0004096	Asthma	Abnormality of the immune system; Abnormality of the respiratory system	C0004096	Asthma	Disease or Syndrome	D001249	Immune System Diseases ; Respiratory Tract Diseases	disease of anatomical entity	disease	null	disease	0.000824180352639	2010
PLG	5340	AlteredExpression	BEFREE	These results show that enhancing uPA/<span class= gene  id= 19098125-9-38-45 >plasmin</span> activity lessens the airway remodeling in a murine <span class= disease  id= 19098125-9-97-103 >asthma</span> model.	19098125	protease; hydrolase	plasminogen	C0004096	Asthma	Abnormality of the immune system; Abnormality of the respiratory system	C0004096	Asthma	Disease or Syndrome	D001249	Immune System Diseases ; Respiratory Tract Diseases	disease of anatomical entity	disease	null	disease	0.000824180352639	2009
PPARA	5465	AlteredExpression	BEFREE	<span class= gene  id= 16312170-4-0-4 >PPAR</span>-y gene expression was evaluated at baseline and 24 hours later in <span class= disease  id= 16312170-4-71-80 >asthmatic</span> patients and controls using real-time polymerase chain reaction.	16312170	transcription factor; receptor; nucleic acid binding	peroxisome proliferator activated receptor alpha	C0004096	Asthma	Abnormality of the immune system; Abnormality of the respiratory system	C0004096	Asthma	Disease or Syndrome	D001249	Immune System Diseases ; Respiratory Tract Diseases	disease of anatomical entity	disease	null	disease	0.000824180352639	2005
ANO1	55107	AlteredExpression	BEFREE	Increased expression of the human <span class= gene  id= 11956057-0-34-60 >Ca2+-activated Cl- channel</span> 1 (CaCC1) gene in the <span class= disease  id= 11956057-0-83-92 >asthmatic</span> airway.	11956057	null	anoctamin 1	C0004096	Asthma	Abnormality of the immune system; Abnormality of the respiratory system	C0004096	Asthma	Disease or Syndrome	D001249	Immune System Diseases ; Respiratory Tract Diseases	disease of anatomical entity	disease	null	disease	0.000824180352639	2002
ANO1	55107	AlteredExpression	BEFREE	A <span class= gene  id= 11842292-0-2-36 >calcium-activated chloride channel</span> (HCLCA1) is strongly related to IL-9 expression and mucus production in bronchial epithelium of patients with <span class= disease  id= 11842292-0-147-153 >asthma</span>.	11842292	null	anoctamin 1	C0004096	Asthma	Abnormality of the immune system; Abnormality of the respiratory system	C0004096	Asthma	Disease or Syndrome	D001249	Immune System Diseases ; Respiratory Tract Diseases	disease of anatomical entity	disease	null	disease	0.000824180352639	2002
LTB4R2	56413	AlteredExpression	BEFREE	These findings indicate that <span class= gene  id= 23603839-10-29-33 >BLT2</span> has a protective role in allergic airway inflammation and that diminished <span class= gene  id= 23603839-10-108-112 >BLT2</span> expression in CD4(+) T cells may contribute to the pathophysiology of <span class= disease  id= 23603839-10-183-189 >asthma</span>.	23603839	receptor	leukotriene B4 receptor 2	C0004096	Asthma	Abnormality of the immune system; Abnormality of the respiratory system	C0004096	Asthma	Disease or Syndrome	D001249	Immune System Diseases ; Respiratory Tract Diseases	disease of anatomical entity	disease	null	disease	0.000824180352639	2013
S100A8	6279	AlteredExpression	BEFREE	The concentrations of <span class= gene  id= 25973752-11-22-28 >S100A8</span> and S100A9 were significantly elevated in <span class= disease  id= 25973752-11-71-80 >asthmatic</span> bronchoalveolar lavage fluid (BALF) when compared to normal BALF (p&lt;0.01), but not in serum.	25973752	signaling molecule; calcium-binding protein	S100 calcium binding protein A8	C0004096	Asthma	Abnormality of the immune system; Abnormality of the respiratory system	C0004096	Asthma	Disease or Syndrome	D001249	Immune System Diseases ; Respiratory Tract Diseases	disease of anatomical entity	disease	null	disease	0.000824180352639	2015
S100A8	6279	AlteredExpression	BEFREE	Quantitative real-time RT-PCR confirmed that the genes related (<span class= gene  id= 19187333-11-64-70 >S100A8</span> and GAS6) and unrelated to infections (CD200 and RBP7) were differentially expressed during <span class= disease  id= 19187333-11-163-169 >asthma</span> exacerbation (P&lt;0.01).	19187333	signaling molecule; calcium-binding protein	S100 calcium binding protein A8	C0004096	Asthma	Abnormality of the immune system; Abnormality of the respiratory system	C0004096	Asthma	Disease or Syndrome	D001249	Immune System Diseases ; Respiratory Tract Diseases	disease of anatomical entity	disease	null	disease	0.000824180352639	2009
