MUC5AC	4586	AlteredExpression	BEFREE	Because an epidermal growth factor receptor (EGFR) cascade induces <span class= gene  id= 11698473-2-67-73 >MUC5AC</span> mucin in airways, and because EGFR is up-regulated in <span class= disease  id= 11698473-2-128-137 >asthmatic</span> airways, we examined the effect of eosinophils on MUC5AC mucin production in NCI-H292 cells (a human airway epithelial cell line that produces mucins).	11698473	cell adhesion molecule; extracellular matrix protein	mucin 5AC, oligomeric mucus/gel-forming	C0004096	Asthma	Abnormality of the immune system; Abnormality of the respiratory system	C0004096	Asthma	Disease or Syndrome	D001249	Immune System Diseases ; Respiratory Tract Diseases	disease of anatomical entity	disease	null	disease	0.010568964137734	2001
MUC5AC	4586	AlteredExpression	BEFREE	AGR2 expression increased together with <span class= gene  id= 22403803-9-40-46 >MUC5AC</span> expression in airway epithelium from  Th2-high  <span class= disease  id= 22403803-9-95-105 >asthmatics</span>.	22403803	cell adhesion molecule; extracellular matrix protein	mucin 5AC, oligomeric mucus/gel-forming	C0004096	Asthma	Abnormality of the immune system; Abnormality of the respiratory system	C0004096	Asthma	Disease or Syndrome	D001249	Immune System Diseases ; Respiratory Tract Diseases	disease of anatomical entity	disease	null	disease	0.010568964137734	2013
MUC5AC	4586	AlteredExpression	BEFREE	<span class= gene  id= 11179133-8-0-6 >MUC5AC</span> was the predominant mucin gene expressed in healthy subjects and subjects with <span class= disease  id= 11179133-8-86-92 >asthma</span>, and <span class= gene  id= 11179133-8-98-104 >MUC5AC</span> protein was increased in the subjects with <span class= disease  id= 11179133-8-148-154 >asthma</span>.	11179133	cell adhesion molecule; extracellular matrix protein	mucin 5AC, oligomeric mucus/gel-forming	C0004096	Asthma	Abnormality of the immune system; Abnormality of the respiratory system	C0004096	Asthma	Disease or Syndrome	D001249	Immune System Diseases ; Respiratory Tract Diseases	disease of anatomical entity	disease	null	disease	0.010568964137734	2001
VCAM1	7412	AlteredExpression	BEFREE	IL-4 mediates important proinflammatory functions in <span class= disease  id= 11398072-1-53-59 >asthma</span>, including induction of the IgE isotype switch, increased expression of <span class= gene  id= 11398072-1-132-165 >vascular cell adhesion molecule 1</span> and promotion of eosinophil transmigration across the endothelium, stimulation of mucus production, and T(H)2 lymphocyte differentiation, leading to release of IL-4, IL-5, IL-9, and IL-13.	11398072	cell adhesion molecule; phosphatase; hydrolase; defense/immunity protein; receptor	vascular cell adhesion molecule 1	C0004096	Asthma	Abnormality of the immune system; Abnormality of the respiratory system	C0004096	Asthma	Disease or Syndrome	D001249	Immune System Diseases ; Respiratory Tract Diseases	disease of anatomical entity	disease	null	disease	0.010554608760417	2001
IL3	3562	AlteredExpression	BEFREE	Further assessment made in 15 of the 24 acute <span class= disease  id= 8835120-6-46-56 >asthmatics</span> 7 days after systemic steroid treatment revealed a significant reduction in GM-CSF expression (P &lt; 0.05) but <span class= negexp >not for</span> <span class= gene  id= 8835120-6-174-178 >IL-3</span>.	8835120	signaling molecule	interleukin 3	C0004096	Asthma	Abnormality of the immune system; Abnormality of the respiratory system	C0004096	Asthma	Disease or Syndrome	D001249	Immune System Diseases ; Respiratory Tract Diseases	disease of anatomical entity	disease	null	disease	0.009968353411995	1996
IL3	3562	AlteredExpression	BEFREE	There were increased proportions of cells positive for <span class= gene  id= 8360390-6-55-59 >IL-3</span> (p &lt; 0.05), IL-4 (p &lt; 0.005), IL-5 (p &lt; 0.005), and GM-CSF (p &lt; 0.005) mRNA in BAL fluid from patients with symptomatic <span class= disease  id= 8360390-6-180-186 >asthma</span> when compared with that from subjects <span class= negexp >free of</span> symptoms, but <span class= negexp >no difference</span> between the groups in numbers of cells expressing IL-2 and interferon-gamma mRNA.	8360390	signaling molecule	interleukin 3	C0004096	Asthma	Abnormality of the immune system; Abnormality of the respiratory system	C0004096	Asthma	Disease or Syndrome	D001249	Immune System Diseases ; Respiratory Tract Diseases	disease of anatomical entity	disease	null	disease	0.009968353411995	1993
IL3	3562	AlteredExpression	BEFREE	Glucocorticoid therapy of <span class= disease  id= 7742019-13-26-36 >asthmatics</span> is associated with a reduction in the percentages of CD4 T-LC expressing <span class= gene  id= 7742019-13-110-114 >IL-3</span>, IL-5, and GM-CSF mRNA and secretion of the corresponding proteins.	7742019	signaling molecule	interleukin 3	C0004096	Asthma	Abnormality of the immune system; Abnormality of the respiratory system	C0004096	Asthma	Disease or Syndrome	D001249	Immune System Diseases ; Respiratory Tract Diseases	disease of anatomical entity	disease	null	disease	0.009968353411995	1995
IL3	3562	AlteredExpression	BEFREE	<span class= gene  id= 21036386-14-0-4 >IL-3</span> can induce basophils to express high levels of amphiregulin, which may contribute to tissue remodeling during type 2 immune responses such as <span class= disease  id= 21036386-14-147-153 >asthma</span>.	21036386	signaling molecule	interleukin 3	C0004096	Asthma	Abnormality of the immune system; Abnormality of the respiratory system	C0004096	Asthma	Disease or Syndrome	D001249	Immune System Diseases ; Respiratory Tract Diseases	disease of anatomical entity	disease	null	disease	0.009968353411995	2010
CXCL10	3627	AlteredExpression	BEFREE	Although corticosteroids can downregulate the expression of some <span class= disease  id= 15696082-12-65-71 >asthma</span>-associated chemokines, such as eotaxin, MCP-3, and MCP-4, they can also upregulate the expression of other chemokines, including IL-8, <span class= gene  id= 15696082-12-207-212 >IP-10</span>, and MCP-2.	15696082	signaling molecule	C-X-C motif chemokine ligand 10	C0004096	Asthma	Abnormality of the immune system; Abnormality of the respiratory system	C0004096	Asthma	Disease or Syndrome	D001249	Immune System Diseases ; Respiratory Tract Diseases	disease of anatomical entity	disease	null	disease	0.00984709809972	2005
CXCL10	3627	AlteredExpression	BEFREE	CpdA inhibited production of fluticasone-resistant chemokines CCL5, CX3CL1, and <span class= gene  id= 25897650-8-80-86 >CXCL10</span> at protein and mRNA levels in both <span class= disease  id= 25897650-8-122-131 >asthmatic</span> and healthy cells.	25897650	signaling molecule	C-X-C motif chemokine ligand 10	C0004096	Asthma	Abnormality of the immune system; Abnormality of the respiratory system	C0004096	Asthma	Disease or Syndrome	D001249	Immune System Diseases ; Respiratory Tract Diseases	disease of anatomical entity	disease	null	disease	0.00984709809972	2016
CXCL10	3627	AlteredExpression	LHGDN	Elevated bronchial mucosal expression of IP-10/CXCL10 is implicated in asthma pathogenesis; its action is partly through selective development and retention, or recruitment of T helper type 2, not Th1, receptor-bearing cells.	15944327	signaling molecule	C-X-C motif chemokine ligand 10	C0004096	Asthma	Abnormality of the immune system; Abnormality of the respiratory system	C0004096	Asthma	Disease or Syndrome	D001249	Immune System Diseases ; Respiratory Tract Diseases	disease of anatomical entity	disease	null	disease	0.00984709809972	2005
HPGDS	27306	AlteredExpression	BEFREE	The protein levels of Gc, hemopexin, and haptoglobin-b were increased, whereas the a1- antitrypsin and <span class= gene  id= 21169467-7-103-128 >glutathione S-transferase</span> levels were decreased in subjects with <span class= disease  id= 21169467-7-168-174 >asthma</span>.	21169467	null	hematopoietic prostaglandin D synthase	C0004096	Asthma	Abnormality of the immune system; Abnormality of the respiratory system	C0004096	Asthma	Disease or Syndrome	D001249	Immune System Diseases ; Respiratory Tract Diseases	disease of anatomical entity	disease	null	disease	0.009615437447459	2011
HPGDS	27306	AlteredExpression	BEFREE	Downregulation of <span class= gene  id= 21570714-0-18-43 >glutathione S-transferase</span> pi in <span class= disease  id= 21570714-0-50-56 >asthma</span> contributes to enhanced oxidative stress.	21570714	null	hematopoietic prostaglandin D synthase	C0004096	Asthma	Abnormality of the immune system; Abnormality of the respiratory system	C0004096	Asthma	Disease or Syndrome	D001249	Immune System Diseases ; Respiratory Tract Diseases	disease of anatomical entity	disease	null	disease	0.009615437447459	2011
SFTPD	6441	AlteredExpression	BEFREE	Expression of <span class= gene  id= 25848896-0-14-34 >surfactant protein D</span> in airways of <span class= disease  id= 25848896-0-49-59 >asthmatics</span> and interleukin-13 modulation of <span class= gene  id= 25848896-0-93-113 >surfactant protein D</span> in human models of airway epithelium.	25848896	defense/immunity protein; surfactant	surfactant protein D	C0004096	Asthma	Abnormality of the immune system; Abnormality of the respiratory system	C0004096	Asthma	Disease or Syndrome	D001249	Immune System Diseases ; Respiratory Tract Diseases	disease of anatomical entity	disease	null	disease	0.009521214158194	2015
IL2RA	3559	AlteredExpression	BEFREE	Our findings also suggest that treatment with inhaled glucocorticosteroids in <span class= disease  id= 19392991-11-78-88 >asthmatics</span> might increase this FOXP3 protein expression within the CD4(+)<span class= gene  id= 19392991-11-151-155 >CD25</span>(high) T-cell population.	19392991	receptor	interleukin 2 receptor subunit alpha	C0004096	Asthma	Abnormality of the immune system; Abnormality of the respiratory system	C0004096	Asthma	Disease or Syndrome	D001249	Immune System Diseases ; Respiratory Tract Diseases	disease of anatomical entity	disease	null	disease	0.009484412378199	2010
IL2RA	3559	AlteredExpression	BEFREE	The six IL-5 mRNA-positive asthmatics tended to have more severe disease than the negative <span class= disease  id= 2022726-11-91-101 >asthmatics</span>, as assessed by symptoms and lung function, and showed a significant increase in the degree of infiltration of the bronchial mucosa by secreting (EG2+) eosinophils and activated (<span class= gene  id= 2022726-11-281-285 >CD25</span>+) T lymphocytes.	2022726	receptor	interleukin 2 receptor subunit alpha	C0004096	Asthma	Abnormality of the immune system; Abnormality of the respiratory system	C0004096	Asthma	Disease or Syndrome	D001249	Immune System Diseases ; Respiratory Tract Diseases	disease of anatomical entity	disease	null	disease	0.009484412378199	1991
IL2RA	3559	AlteredExpression	BEFREE	Experiments revealed raised proportions of activated CD4+ T cells as assessed by expression of HLA-DR and <span class= gene  id= 11422132-6-106-110 >CD25</span>+ expression in the <span class= disease  id= 11422132-6-130-139 >asthmatic</span> samples.	11422132	receptor	interleukin 2 receptor subunit alpha	C0004096	Asthma	Abnormality of the immune system; Abnormality of the respiratory system	C0004096	Asthma	Disease or Syndrome	D001249	Immune System Diseases ; Respiratory Tract Diseases	disease of anatomical entity	disease	null	disease	0.009484412378199	2001
IL2RA	3559	AlteredExpression	BEFREE	Impaired Ca²? regulation of CD4?<span class= gene  id= 21576985-0-32-36 >CD25</span>? regulatory T cells from pediatric <span class= disease  id= 21576985-0-72-78 >asthma</span>.	21576985	receptor	interleukin 2 receptor subunit alpha	C0004096	Asthma	Abnormality of the immune system; Abnormality of the respiratory system	C0004096	Asthma	Disease or Syndrome	D001249	Immune System Diseases ; Respiratory Tract Diseases	disease of anatomical entity	disease	null	disease	0.009484412378199	2010
IL2RA	3559	AlteredExpression	BEFREE	The percentages of both CD4 and CD8 T lymphocytes expressing HLA-DR and <span class= gene  id= 11826234-8-72-76 >CD25</span> were elevated in the <span class= disease  id= 11826234-8-98-108 >asthmatics</span> as compared with controls, and significantly reduced in association with de novo or augmented inhaled glucocorticoid therapy.	11826234	receptor	interleukin 2 receptor subunit alpha	C0004096	Asthma	Abnormality of the immune system; Abnormality of the respiratory system	C0004096	Asthma	Disease or Syndrome	D001249	Immune System Diseases ; Respiratory Tract Diseases	disease of anatomical entity	disease	null	disease	0.009484412378199	2002
IGHE	3497	AlteredExpression	BEFREE	Regulation of low affinity <span class= gene  id= 1401914-0-27-30 >IgE</span> receptor (CD23) expression on mononuclear phagocytes in normal and <span class= disease  id= 1401914-0-98-107 >asthmatic</span> subjects.	1401914	null	immunoglobulin heavy constant epsilon	C0004096	Asthma	Abnormality of the immune system; Abnormality of the respiratory system	C0004096	Asthma	Disease or Syndrome	D001249	Immune System Diseases ; Respiratory Tract Diseases	disease of anatomical entity	disease	null	disease	0.009326355285928	1992
IGHE	3497	AlteredExpression	BEFREE	The dendritic cell high-affinity <span class= gene  id= 26503747-0-33-36 >IgE</span> receptor is overexpressed in both <span class= disease  id= 26503747-0-71-77 >asthma</span> and severe COPD.	26503747	null	immunoglobulin heavy constant epsilon	C0004096	Asthma	Abnormality of the immune system; Abnormality of the respiratory system	C0004096	Asthma	Disease or Syndrome	D001249	Immune System Diseases ; Respiratory Tract Diseases	disease of anatomical entity	disease	null	disease	0.009326355285928	2015
IGHE	3497	AlteredExpression	BEFREE	Particularly, the expression of high affinity <span class= gene  id= 22580035-3-46-49 >IgE</span> receptor (Fc?RI) has been noted in primary human ASM cells in vitro and in vivo within bronchial biopsies of allergic <span class= disease  id= 22580035-3-168-177 >asthmatic</span> subjects.	22580035	null	immunoglobulin heavy constant epsilon	C0004096	Asthma	Abnormality of the immune system; Abnormality of the respiratory system	C0004096	Asthma	Disease or Syndrome	D001249	Immune System Diseases ; Respiratory Tract Diseases	disease of anatomical entity	disease	null	disease	0.009326355285928	2012
IGHE	3497	AlteredExpression	BEFREE	This antibody directly inhibits the activation of the high affinity <span class= gene  id= 20444694-6-68-71 >IgE</span> receptor FcepsilonRI on mast cells and basophils by cross-linking FcepsilonRI with the inhibitory receptor FcgammaRIIb, an approach that has strong therapeutic potential for <span class= disease  id= 20444694-6-246-252 >asthma</span> and other allergic diseases.	20444694	null	immunoglobulin heavy constant epsilon	C0004096	Asthma	Abnormality of the immune system; Abnormality of the respiratory system	C0004096	Asthma	Disease or Syndrome	D001249	Immune System Diseases ; Respiratory Tract Diseases	disease of anatomical entity	disease	null	disease	0.009326355285928	2010
IGHE	3497	AlteredExpression	LHGDN	A highly significant association of the newly studied (GAAGGA) (n) hexanucleotide repeat with asthma (p = 3x10 (-6)), log (10) TsIgE (p = 0.006) and eotaxin levels (p = 0.004) was observed.	17220216	null	immunoglobulin heavy constant epsilon	C0004096	Asthma	Abnormality of the immune system; Abnormality of the respiratory system	C0004096	Asthma	Disease or Syndrome	D001249	Immune System Diseases ; Respiratory Tract Diseases	disease of anatomical entity	disease	null	disease	0.009326355285928	2007
IL16	3603	AlteredExpression	BEFREE	Sputum samples from <span class= disease  id= 10572065-12-20-29 >asthmatic</span> subjects were found to have higher levels of <span class= gene  id= 10572065-12-75-80 >IL-16</span> than were samples from subjects with other pulmonary inflammatory diseases.	10572065	signaling molecule	interleukin 16	C0004096	Asthma	Abnormality of the immune system; Abnormality of the respiratory system	C0004096	Asthma	Disease or Syndrome	D001249	Immune System Diseases ; Respiratory Tract Diseases	disease of anatomical entity	disease	null	disease	0.009144173059356	2000
IL16	3603	AlteredExpression	BEFREE	Increased expression of <span class= gene  id= 10932073-0-24-29 >IL-16</span> immunoreactivity in bronchial mucosa after segmental allergen challenge in patients with <span class= disease  id= 10932073-0-119-125 >asthma</span>.	10932073	signaling molecule	interleukin 16	C0004096	Asthma	Abnormality of the immune system; Abnormality of the respiratory system	C0004096	Asthma	Disease or Syndrome	D001249	Immune System Diseases ; Respiratory Tract Diseases	disease of anatomical entity	disease	null	disease	0.009144173059356	2000
C5AR1	728	AlteredExpression	LHGDN	determination of whether the levels of complement factors C3a, C4a, and C5a are elevated at the site of inflammation in chronic obstructive pulmonary disease and in asthma	15039137	receptor	complement C5a receptor 1	C0004096	Asthma	Abnormality of the immune system; Abnormality of the respiratory system	C0004096	Asthma	Disease or Syndrome	D001249	Immune System Diseases ; Respiratory Tract Diseases	disease of anatomical entity	disease	null	disease	0.008971760589768	2004
MMP1	4312	AlteredExpression	BEFREE	Exposure or colonization by SA in the airway may enhance the remodeling of tissue through a TGF-&alpha;-dependent induction of <span class= gene  id= 25180535-10-121-126 >MMP-1</span> expression, and may thereby promote remodeling in airway diseases in which SA is implicated, such as <span class= disease  id= 25180535-10-228-234 >asthma</span> and chronic rhinosinusitis.	25180535	null	matrix metallopeptidase 1	C0004096	Asthma	Abnormality of the immune system; Abnormality of the respiratory system	C0004096	Asthma	Disease or Syndrome	D001249	Immune System Diseases ; Respiratory Tract Diseases	disease of anatomical entity	disease	null	disease	0.008645876648242	2016
MMP1	4312	AlteredExpression	BEFREE	We conclude that cells contained in the bronchial secretions from <span class= disease  id= 14968124-7-66-76 >asthmatics</span> express higher amounts of mRNA for <span class= gene  id= 14968124-7-112-117 >MMP-1</span> and TIMP-1, perhaps related to an increased expression of MCP-1, which might contribute to the extracellular matrix changes observed during airway remodelling.	14968124	null	matrix metallopeptidase 1	C0004096	Asthma	Abnormality of the immune system; Abnormality of the respiratory system	C0004096	Asthma	Disease or Syndrome	D001249	Immune System Diseases ; Respiratory Tract Diseases	disease of anatomical entity	disease	null	disease	0.008645876648242	2004
MMP1	4312	AlteredExpression	BEFREE	These findings correlated clinically to the significantly higher plasma/serum <span class= gene  id= 24469321-7-78-83 >MMP-1</span> level in <span class= disease  id= 24469321-7-93-102 >asthmatic</span> patients.	24469321	null	matrix metallopeptidase 1	C0004096	Asthma	Abnormality of the immune system; Abnormality of the respiratory system	C0004096	Asthma	Disease or Syndrome	D001249	Immune System Diseases ; Respiratory Tract Diseases	disease of anatomical entity	disease	null	disease	0.008645876648242	2014
MMP1	4312	AlteredExpression	BEFREE	Extra-cellular matrix proteins induce <span class= gene  id= 24587395-0-38-64 >matrix metalloproteinase-1</span> (<span class= gene  id= 24587395-0-66-71 >MMP-1</span>) activity and increase airway smooth muscle contraction in <span class= disease  id= 24587395-0-131-137 >asthma</span>.	24587395	null	matrix metallopeptidase 1	C0004096	Asthma	Abnormality of the immune system; Abnormality of the respiratory system	C0004096	Asthma	Disease or Syndrome	D001249	Immune System Diseases ; Respiratory Tract Diseases	disease of anatomical entity	disease	null	disease	0.008645876648242	2014
CD28	940	AlteredExpression	BEFREE	Selective blockade of NF-kappaB by novel mutated IkappaBalpha suppresses CD3/<span class= gene  id= 18070230-0-77-81 >CD28</span>-induced activation of memory CD4+ T cells in <span class= disease  id= 18070230-0-127-133 >asthma</span>.	18070230	signaling molecule	CD28 molecule	C0004096	Asthma	Abnormality of the immune system; Abnormality of the respiratory system	C0004096	Asthma	Disease or Syndrome	D001249	Immune System Diseases ; Respiratory Tract Diseases	disease of anatomical entity	disease	null	disease	0.00859471949093	2008
LEP	3952	AlteredExpression	BEFREE	Serum levels of <span class= gene  id= 19725899-2-16-22 >leptin</span>, adiponectin, mite allergen-specific and total immunoglobulin E, eosinophil cationic protein (ECP), and pro- and anti-inflammatory cytokines were analysed in 97 non-<span class= disease  id= 19725899-2-188-197 >asthmatic</span> children presenting with persistent AR and in 64 controls.	19725899	null	leptin	C0004096	Asthma	Abnormality of the immune system; Abnormality of the respiratory system	C0004096	Asthma	Disease or Syndrome	D001249	Immune System Diseases ; Respiratory Tract Diseases	disease of anatomical entity	disease	null	disease	0.008422307021342	2011
NPS	594857	AlteredExpression	LHGDN	Because remodeling of airway epithelium is a feature of chronic asthma, the up-regulation of MMP10 and TIMP3 by NPS-NPSR1 signaling may be of relevance in the pathogenesis of asthma.	16926187	null	neuropeptide S	C0004096	Asthma	Abnormality of the immune system; Abnormality of the respiratory system	C0004096	Asthma	Disease or Syndrome	D001249	Immune System Diseases ; Respiratory Tract Diseases	disease of anatomical entity	disease	null	disease	0.008422307021342	2006
C3AR1	719	AlteredExpression	LHGDN	determination of whether the levels of complement factors C3a, C4a, and C5a are elevated at the site of inflammation in chronic obstructive pulmonary disease and in asthma	15039137	receptor	complement C3a receptor 1	C0004096	Asthma	Abnormality of the immune system; Abnormality of the respiratory system	C0004096	Asthma	Disease or Syndrome	D001249	Immune System Diseases ; Respiratory Tract Diseases	disease of anatomical entity	disease	null	disease	0.008371149864029	2004
C3AR1	719	AlteredExpression	BEFREE	These results demonstrate the expression of <span class= gene  id= 11160252-9-44-48 >C3aR</span> and C5aR by cells endogenous to the lung, and, given the participation of bronchial epithelial and smooth muscle cells in the pathology of diseases such as sepsis and <span class= disease  id= 11160252-9-216-222 >asthma</span>, the data suggest a role for these receptors during lung inflammation.	11160252	receptor	complement C3a receptor 1	C0004096	Asthma	Abnormality of the immune system; Abnormality of the respiratory system	C0004096	Asthma	Disease or Syndrome	D001249	Immune System Diseases ; Respiratory Tract Diseases	disease of anatomical entity	disease	null	disease	0.008371149864029	2001
IFNA1	3439	AlteredExpression	BEFREE	<span class= gene  id= 24450586-8-0-3 >IFN</span>-&alpha;1, <span class= gene  id= 24450586-8-8-11 >IFN</span>-&beta;1 and IFN-&gamma; mRNA levels correlated with the peak <span class= disease  id= 24450586-8-62-68 >Asthma</span> Index (r = 0.58, P &lt; 0.001; r = 0.57, P = 0.001; and r = 0.51, P = 0.004, respectively).	24450586	signaling molecule	interferon alpha 1	C0004096	Asthma	Abnormality of the immune system; Abnormality of the respiratory system	C0004096	Asthma	Disease or Syndrome	D001249	Immune System Diseases ; Respiratory Tract Diseases	disease of anatomical entity	disease	null	disease	0.008161935614446	2014
IFNA1	3439	AlteredExpression	BEFREE	Type III <span class= gene  id= 18564328-0-9-12 >IFN</span>-lambda mRNA expression in sputum of adult and school-aged <span class= disease  id= 18564328-0-71-81 >asthmatics</span>.	18564328	signaling molecule	interferon alpha 1	C0004096	Asthma	Abnormality of the immune system; Abnormality of the respiratory system	C0004096	Asthma	Disease or Syndrome	D001249	Immune System Diseases ; Respiratory Tract Diseases	disease of anatomical entity	disease	null	disease	0.008161935614446	2009
IFNA1	3439	AlteredExpression	BEFREE	Our data demonstrate that both <span class= gene  id= 20382746-11-31-34 >IFN</span>s and mitogens stimulate protein synthesis but have differential effects on cell size and contractile protein expression and suggest that combined effects of <span class= gene  id= 20382746-11-192-195 >IFN</span>s and mitogens may contribute to ASM cell growth, contractile protein expression, and ASM remodeling in <span class= disease  id= 20382746-11-299-305 >asthma</span>.	20382746	signaling molecule	interferon alpha 1	C0004096	Asthma	Abnormality of the immune system; Abnormality of the respiratory system	C0004096	Asthma	Disease or Syndrome	D001249	Immune System Diseases ; Respiratory Tract Diseases	disease of anatomical entity	disease	null	disease	0.008161935614446	2010
IRAK3	11213	AlteredExpression	BEFREE	Our data indicate that epithelial <span class= gene  id= 22154382-13-34-40 >IRAK-M</span> overexpression in T(H)2 cytokine-exposed airways inhibits TLR2 signaling, providing a novel mechanism for the increased susceptibility of infections in <span class= disease  id= 22154382-13-193-202 >asthmatic</span> patients.	22154382	null	interleukin 1 receptor associated kinase 3	C0004096	Asthma	Abnormality of the immune system; Abnormality of the respiratory system	C0004096	Asthma	Disease or Syndrome	D001249	Immune System Diseases ; Respiratory Tract Diseases	disease of anatomical entity	disease	null	disease	0.008096423079816	2011
